"No.","Time","Source","Destination","Protocol","Length","Info"
"1","0.000000","192.168.100.139","13.107.43.12","TLSv1.2","696","Application Data"
"2","0.108471","13.107.43.12","192.168.100.139","TCP","60","443  >  65222 [ACK] Seq=1 Ack=643 Win=16384 Len=0"
"3","0.286906","13.107.43.12","192.168.100.139","TLSv1.2","950","Application Data"
"4","0.286908","13.107.43.12","192.168.100.139","TLSv1.2","111","Application Data"
"5","0.287196","192.168.100.139","13.107.43.12","TCP","54","65222  >  443 [ACK] Seq=643 Ack=954 Win=1025 Len=0"
"6","1.066672","2603:1063:2204::1f","2800:cd0:bb1b:6b00:5ce6:9a9d:6e99:5810","TLSv1.2","107","Application Data"
"7","1.117310","2800:cd0:bb1b:6b00:5ce6:9a9d:6e99:5810","2603:1063:2204::1f","TCP","74","64761  >  443 [ACK] Seq=1 Ack=34 Win=1023 Len=0"
"8","3.163790","2800:cd0:bb1b:6b00:5ce6:9a9d:6e99:5810","2800:cd0:ff:0:200:87:100:10","DNS","100","Standard query 0xa105 A catalog.gamepass.com"
"9","3.163996","2800:cd0:bb1b:6b00:5ce6:9a9d:6e99:5810","2800:cd0:ff:0:200:87:100:10","DNS","100","Standard query 0x55b9 AAAA catalog.gamepass.com"
"10","3.190613","2800:cd0:ff:0:200:87:100:10","2800:cd0:bb1b:6b00:5ce6:9a9d:6e99:5810","DNS","236","Standard query response 0x55b9 AAAA catalog.gamepass.com CNAME catalog.gamepass.com.edgesuite.net CNAME a1992.dscd.akamai.net AAAA 2600:1419:b400::173f:1c12 AAAA 2600:1419:b400::173f:1c20"
"11","3.190614","2800:cd0:ff:0:200:87:100:10","2800:cd0:bb1b:6b00:5ce6:9a9d:6e99:5810","DNS","212","Standard query response 0xa105 A catalog.gamepass.com CNAME catalog.gamepass.com.edgesuite.net CNAME a1992.dscd.akamai.net A 104.101.21.65 A 104.101.21.66"
"12","3.197094","2800:cd0:bb1b:6b00:5ce6:9a9d:6e99:5810","2600:1419:b400::173f:1c12","TCP","86","65259  >  443 [SYN] Seq=0 Win=64952 Len=0 MSS=1412 WS=256 SACK_PERM=1"
"13","3.282607","2600:1419:b400::173f:1c12","2800:cd0:bb1b:6b00:5ce6:9a9d:6e99:5810","TCP","86","443  >  65259 [SYN, ACK] Seq=0 Ack=1 Win=64800 Len=0 MSS=1440 SACK_PERM=1 WS=128"
"14","3.282937","2800:cd0:bb1b:6b00:5ce6:9a9d:6e99:5810","2600:1419:b400::173f:1c12","TCP","74","65259  >  443 [ACK] Seq=1 Ack=1 Win=262400 Len=0"
"15","3.283802","2800:cd0:bb1b:6b00:5ce6:9a9d:6e99:5810","2600:1419:b400::173f:1c12","TLSv1.2","279","Client Hello"
"16","3.368367","2600:1419:b400::173f:1c12","2800:cd0:bb1b:6b00:5ce6:9a9d:6e99:5810","TCP","74","443  >  65259 [ACK] Seq=1 Ack=206 Win=64640 Len=0"
"17","3.370026","2600:1419:b400::173f:1c12","2800:cd0:bb1b:6b00:5ce6:9a9d:6e99:5810","TLSv1.2","1486","Server Hello"
"18","3.370031","2600:1419:b400::173f:1c12","2800:cd0:bb1b:6b00:5ce6:9a9d:6e99:5810","TLSv1.2","1486","Certificate [TCP segment of a reassembled PDU]"
"19","3.370032","2600:1419:b400::173f:1c12","2800:cd0:bb1b:6b00:5ce6:9a9d:6e99:5810","TLSv1.2","1060","Certificate Status, Server Key Exchange, Server Hello Done"
"20","3.370253","2800:cd0:bb1b:6b00:5ce6:9a9d:6e99:5810","2600:1419:b400::173f:1c12","TCP","74","65259  >  443 [ACK] Seq=206 Ack=3811 Win=262400 Len=0"
"21","3.373181","2800:cd0:bb1b:6b00:5ce6:9a9d:6e99:5810","2600:1419:b400::173f:1c12","TLSv1.2","200","Client Key Exchange, Change Cipher Spec, Encrypted Handshake Message"
"22","3.460110","2600:1419:b400::173f:1c12","2800:cd0:bb1b:6b00:5ce6:9a9d:6e99:5810","TCP","74","443  >  65259 [ACK] Seq=3811 Ack=332 Win=64640 Len=0"
"23","3.460328","2600:1419:b400::173f:1c12","2800:cd0:bb1b:6b00:5ce6:9a9d:6e99:5810","TLSv1.2","332","New Session Ticket, Change Cipher Spec, Encrypted Handshake Message"
"24","3.461738","2800:cd0:bb1b:6b00:5ce6:9a9d:6e99:5810","2600:1419:b400::173f:1c12","TLSv1.2","161","Application Data"
"25","3.461771","2800:cd0:bb1b:6b00:5ce6:9a9d:6e99:5810","2600:1419:b400::173f:1c12","TLSv1.2","196","Application Data"
"26","3.548349","2600:1419:b400::173f:1c12","2800:cd0:bb1b:6b00:5ce6:9a9d:6e99:5810","TCP","74","443  >  65259 [ACK] Seq=4069 Ack=419 Win=64640 Len=0"
"27","3.548350","2600:1419:b400::173f:1c12","2800:cd0:bb1b:6b00:5ce6:9a9d:6e99:5810","TCP","74","443  >  65259 [ACK] Seq=4069 Ack=541 Win=64640 Len=0"
"28","3.549486","2600:1419:b400::173f:1c12","2800:cd0:bb1b:6b00:5ce6:9a9d:6e99:5810","TLSv1.2","142","Application Data"
"29","3.549486","2600:1419:b400::173f:1c12","2800:cd0:bb1b:6b00:5ce6:9a9d:6e99:5810","TLSv1.2","112","Application Data"
"30","3.549487","2600:1419:b400::173f:1c12","2800:cd0:bb1b:6b00:5ce6:9a9d:6e99:5810","TLSv1.2","227","Application Data"
"31","3.549710","2800:cd0:bb1b:6b00:5ce6:9a9d:6e99:5810","2600:1419:b400::173f:1c12","TCP","74","65259  >  443 [ACK] Seq=541 Ack=4328 Win=261888 Len=0"
"32","3.549748","2600:1419:b400::173f:1c12","2800:cd0:bb1b:6b00:5ce6:9a9d:6e99:5810","TLSv1.2","112","Application Data"
"33","3.549834","2800:cd0:bb1b:6b00:5ce6:9a9d:6e99:5810","2600:1419:b400::173f:1c12","TCP","74","65259  >  443 [ACK] Seq=541 Ack=4366 Win=261888 Len=0"
"34","3.550091","2800:cd0:bb1b:6b00:5ce6:9a9d:6e99:5810","2600:1419:b400::173f:1c12","TLSv1.2","112","Application Data"
"35","3.550306","2800:cd0:bb1b:6b00:5ce6:9a9d:6e99:5810","2600:1419:b400::173f:1c12","TCP","74","65259  >  443 [FIN, ACK] Seq=579 Ack=4366 Win=261888 Len=0"
"36","3.640423","2600:1419:b400::173f:1c12","2800:cd0:bb1b:6b00:5ce6:9a9d:6e99:5810","TCP","74","443  >  65259 [ACK] Seq=4366 Ack=579 Win=64640 Len=0"
"37","3.640966","2600:1419:b400::173f:1c12","2800:cd0:bb1b:6b00:5ce6:9a9d:6e99:5810","TLSv1.2","105","Encrypted Alert"
"38","3.640966","2600:1419:b400::173f:1c12","2800:cd0:bb1b:6b00:5ce6:9a9d:6e99:5810","TCP","74","443  >  65259 [FIN, ACK] Seq=4397 Ack=580 Win=64640 Len=0"
"39","3.641362","2800:cd0:bb1b:6b00:5ce6:9a9d:6e99:5810","2600:1419:b400::173f:1c12","TCP","74","65259  >  443 [RST, ACK] Seq=580 Ack=4397 Win=0 Len=0"
"40","8.307213","192.168.100.139","13.107.42.12","TLSv1.2","474","Application Data"
"41","8.307249","192.168.100.139","13.107.42.12","TLSv1.2","305","Application Data"
"42","8.378298","192.168.100.139","13.107.43.12","TCP","1466","65222  >  443 [ACK] Seq=643 Ack=954 Win=1025 Len=1412 [TCP segment of a reassembled PDU]"
"43","8.378303","192.168.100.139","13.107.43.12","TLSv1.2","647","Application Data"
"44","8.378433","192.168.100.139","13.107.43.12","TCP","1466","65222  >  443 [ACK] Seq=2648 Ack=954 Win=1025 Len=1412 [TCP segment of a reassembled PDU]"
"45","8.378434","192.168.100.139","13.107.43.12","TLSv1.2","144","Application Data"
"46","8.412322","13.107.42.12","192.168.100.139","TCP","60","443  >  64871 [ACK] Seq=1 Ack=672 Win=16381 Len=0"
"47","8.486397","13.107.43.12","192.168.100.139","TCP","60","443  >  65222 [ACK] Seq=954 Ack=2648 Win=16386 Len=0"
"48","8.487201","13.107.43.12","192.168.100.139","TCP","60","443  >  65222 [ACK] Seq=954 Ack=4060 Win=16386 Len=0"
"49","8.487202","13.107.43.12","192.168.100.139","TCP","60","443  >  65222 [ACK] Seq=954 Ack=4150 Win=16386 Len=0"
"50","8.578598","13.107.42.12","192.168.100.139","TLSv1.2","948","Application Data"
"51","8.578600","13.107.42.12","192.168.100.139","TLSv1.2","111","Application Data"
"52","8.578821","192.168.100.139","13.107.42.12","TCP","54","64871  >  443 [ACK] Seq=672 Ack=952 Win=1025 Len=0"
"53","8.785836","13.107.43.12","192.168.100.139","TLSv1.2","1173","Application Data"
"54","8.785837","13.107.43.12","192.168.100.139","TLSv1.2","1083","Application Data"
"55","8.786132","192.168.100.139","13.107.43.12","TCP","54","65222  >  443 [ACK] Seq=4150 Ack=3102 Win=1025 Len=0"
"56","9.063621","IntelCor_00:bb:56","Broadcast","ARP","42","Who has 192.168.100.1? Tell 192.168.100.139"
"57","9.064281","HuaweiTe_e0:42:dc","IntelCor_00:bb:56","ARP","60","192.168.100.1 is at 10:51:72:e0:42:dc"
"58","9.064356","HuaweiTe_e0:42:dc","IntelCor_00:bb:56","ARP","60","192.168.100.1 is at 10:51:72:e0:42:dc"
"59","9.071753","192.168.100.139","239.255.255.250","SSDP","179","M-SEARCH * HTTP/1.1 "
"60","11.802868","192.168.100.122","192.168.100.255","UDP","82","57621  >  57621 Len=40"
"61","12.074323","192.168.100.139","239.255.255.250","SSDP","179","M-SEARCH * HTTP/1.1 "
"62","12.251655","20.10.31.115","192.168.100.139","TLSv1.2","797","Application Data"
"63","12.254337","192.168.100.139","20.10.31.115","TLSv1.2","133","Application Data"
"64","12.262841","192.168.100.139","13.107.42.12","TCP","1466","65242  >  443 [ACK] Seq=1 Ack=1 Win=1025 Len=1412 [TCP segment of a reassembled PDU]"
"65","12.262858","192.168.100.139","13.107.42.12","TLSv1.2","902","Application Data"
"66","12.366713","13.107.42.12","192.168.100.139","TCP","60","443  >  65242 [ACK] Seq=1 Ack=2261 Win=16386 Len=0"
"67","12.478072","20.10.31.115","192.168.100.139","TCP","60","443  >  60160 [ACK] Seq=744 Ack=80 Win=7631 Len=0"
"68","12.597090","13.107.42.12","192.168.100.139","TCP","1466","443  >  65242 [ACK] Seq=1 Ack=2261 Win=16386 Len=1412 [TCP segment of a reassembled PDU]"
"69","12.597091","13.107.42.12","192.168.100.139","TLSv1.2","1331","Application Data"
"70","12.597395","192.168.100.139","13.107.42.12","TCP","54","65242  >  443 [ACK] Seq=2261 Ack=2690 Win=1025 Len=0"
"71","15.077323","192.168.100.139","239.255.255.250","SSDP","179","M-SEARCH * HTTP/1.1 "
"72","17.043264","2603:1063:2204::1f","2800:cd0:bb1b:6b00:5ce6:9a9d:6e99:5810","TLSv1.2","107","Application Data"
"73","17.090248","2800:cd0:bb1b:6b00:5ce6:9a9d:6e99:5810","2603:1063:2204::1f","TCP","74","64761  >  443 [ACK] Seq=1 Ack=67 Win=1023 Len=0"
"74","18.102187","192.168.100.139","239.255.255.250","SSDP","179","M-SEARCH * HTTP/1.1 "
"75","20.059295","2800:cd0:bb1b:6b00:5ce6:9a9d:6e99:5810","2800:cd0:ff:0:200:87:100:10","DNS","93","Standard query 0x6eb2 AAAA www.potosi.bo"
"76","20.059369","2800:cd0:bb1b:6b00:5ce6:9a9d:6e99:5810","2800:cd0:ff:0:200:87:100:10","DNS","93","Standard query 0x6a3d A www.potosi.bo"
"77","20.085885","2800:cd0:ff:0:200:87:100:10","2800:cd0:bb1b:6b00:5ce6:9a9d:6e99:5810","DNS","109","Standard query response 0x6a3d A www.potosi.bo A 181.188.188.204"
"78","20.085886","2800:cd0:ff:0:200:87:100:10","2800:cd0:bb1b:6b00:5ce6:9a9d:6e99:5810","DNS","134","Standard query response 0x6eb2 AAAA www.potosi.bo SOA potosi.bo"
"79","20.088126","192.168.100.139","181.188.188.204","TCP","66","65260  >  443 [SYN] Seq=0 Win=64240 Len=0 MSS=1460 WS=256 SACK_PERM=1"
"80","20.088919","192.168.100.139","181.188.188.204","TCP","66","65261  >  443 [SYN] Seq=0 Win=64240 Len=0 MSS=1460 WS=256 SACK_PERM=1"
"81","20.106941","181.188.188.204","192.168.100.139","TCP","60","443  >  65260 [RST, ACK] Seq=1 Ack=1 Win=0 Len=0"
"82","20.107781","181.188.188.204","192.168.100.139","TCP","60","443  >  65261 [RST, ACK] Seq=1 Ack=1 Win=0 Len=0"
"83","20.332824","192.168.100.139","181.188.188.204","TCP","66","65262  >  443 [SYN] Seq=0 Win=64240 Len=0 MSS=1460 WS=256 SACK_PERM=1"
"84","20.352164","181.188.188.204","192.168.100.139","TCP","60","443  >  65262 [RST, ACK] Seq=1 Ack=1 Win=0 Len=0"
"85","20.619177","192.168.100.139","181.188.188.204","TCP","66","[TCP Retransmission] 65261  >  443 [SYN] Seq=0 Win=64240 Len=0 MSS=1460 WS=256 SACK_PERM=1"
"86","20.619178","192.168.100.139","181.188.188.204","TCP","66","[TCP Retransmission] 65260  >  443 [SYN] Seq=0 Win=64240 Len=0 MSS=1460 WS=256 SACK_PERM=1"
"87","20.638658","181.188.188.204","192.168.100.139","TCP","60","443  >  65261 [RST, ACK] Seq=1 Ack=1 Win=0 Len=0"
"88","20.638749","181.188.188.204","192.168.100.139","TCP","60","443  >  65260 [RST, ACK] Seq=1 Ack=1 Win=0 Len=0"
"89","20.859064","192.168.100.139","181.188.188.204","TCP","66","[TCP Retransmission] 65262  >  443 [SYN] Seq=0 Win=64240 Len=0 MSS=1460 WS=256 SACK_PERM=1"
"90","20.877981","181.188.188.204","192.168.100.139","TCP","60","443  >  65262 [RST, ACK] Seq=1 Ack=1 Win=0 Len=0"
"91","21.112406","192.168.100.139","239.255.255.250","SSDP","179","M-SEARCH * HTTP/1.1 "
"92","21.144107","192.168.100.139","181.188.188.204","TCP","66","[TCP Retransmission] 65261  >  443 [SYN] Seq=0 Win=64240 Len=0 MSS=1460 WS=256 SACK_PERM=1"
"93","21.144110","192.168.100.139","181.188.188.204","TCP","66","[TCP Retransmission] 65260  >  443 [SYN] Seq=0 Win=64240 Len=0 MSS=1460 WS=256 SACK_PERM=1"
"94","21.163563","181.188.188.204","192.168.100.139","TCP","60","443  >  65260 [RST, ACK] Seq=1 Ack=1 Win=0 Len=0"
"95","21.163705","181.188.188.204","192.168.100.139","TCP","60","443  >  65261 [RST, ACK] Seq=1 Ack=1 Win=0 Len=0"
"96","21.383167","192.168.100.139","181.188.188.204","TCP","66","[TCP Retransmission] 65262  >  443 [SYN] Seq=0 Win=64240 Len=0 MSS=1460 WS=256 SACK_PERM=1"
"97","21.402817","181.188.188.204","192.168.100.139","TCP","60","443  >  65262 [RST, ACK] Seq=1 Ack=1 Win=0 Len=0"
"98","21.670136","192.168.100.139","181.188.188.204","TCP","66","[TCP Retransmission] 65261  >  443 [SYN] Seq=0 Win=64240 Len=0 MSS=1460 WS=256 SACK_PERM=1"
"99","21.670138","192.168.100.139","181.188.188.204","TCP","66","[TCP Retransmission] 65260  >  443 [SYN] Seq=0 Win=64240 Len=0 MSS=1460 WS=256 SACK_PERM=1"
"100","21.689638","181.188.188.204","192.168.100.139","TCP","60","443  >  65260 [RST, ACK] Seq=1 Ack=1 Win=0 Len=0"
"101","21.689725","181.188.188.204","192.168.100.139","TCP","60","443  >  65261 [RST, ACK] Seq=1 Ack=1 Win=0 Len=0"
"102","21.908209","192.168.100.139","181.188.188.204","TCP","66","[TCP Retransmission] 65262  >  443 [SYN] Seq=0 Win=64240 Len=0 MSS=1460 WS=256 SACK_PERM=1"
"103","21.927769","181.188.188.204","192.168.100.139","TCP","60","443  >  65262 [RST, ACK] Seq=1 Ack=1 Win=0 Len=0"
"104","22.194264","192.168.100.139","181.188.188.204","TCP","66","[TCP Retransmission] 65260  >  443 [SYN] Seq=0 Win=64240 Len=0 MSS=1460 WS=256 SACK_PERM=1"
"105","22.194276","192.168.100.139","181.188.188.204","TCP","66","[TCP Retransmission] 65261  >  443 [SYN] Seq=0 Win=64240 Len=0 MSS=1460 WS=256 SACK_PERM=1"
"106","22.213369","181.188.188.204","192.168.100.139","TCP","60","443  >  65261 [RST, ACK] Seq=1 Ack=1 Win=0 Len=0"
"107","22.213371","181.188.188.204","192.168.100.139","TCP","60","443  >  65260 [RST, ACK] Seq=1 Ack=1 Win=0 Len=0"
"108","22.255539","192.168.100.139","181.188.188.204","TCP","66","65263  >  80 [SYN] Seq=0 Win=64240 Len=0 MSS=1460 WS=256 SACK_PERM=1"
"109","22.256066","192.168.100.139","181.188.188.204","TCP","66","65264  >  80 [SYN] Seq=0 Win=64240 Len=0 MSS=1460 WS=256 SACK_PERM=1"
"110","22.274363","181.188.188.204","192.168.100.139","TCP","66","80  >  65264 [SYN, ACK] Seq=0 Ack=1 Win=64240 Len=0 MSS=1412 SACK_PERM=1 WS=128"
"111","22.274523","192.168.100.139","181.188.188.204","TCP","54","65264  >  80 [ACK] Seq=1 Ack=1 Win=262400 Len=0"
"112","22.274561","181.188.188.204","192.168.100.139","TCP","66","80  >  65263 [SYN, ACK] Seq=0 Ack=1 Win=64240 Len=0 MSS=1412 SACK_PERM=1 WS=128"
"113","22.274719","192.168.100.139","181.188.188.204","TCP","54","65263  >  80 [ACK] Seq=1 Ack=1 Win=262400 Len=0"
"114","22.433135","192.168.100.139","181.188.188.204","TCP","66","[TCP Retransmission] 65262  >  443 [SYN] Seq=0 Win=64240 Len=0 MSS=1460 WS=256 SACK_PERM=1"
"115","22.452587","181.188.188.204","192.168.100.139","TCP","60","443  >  65262 [RST, ACK] Seq=1 Ack=1 Win=0 Len=0"
"116","22.459533","192.168.100.139","181.188.188.204","HTTP","455","GET / HTTP/1.1 "
"117","22.478661","181.188.188.204","192.168.100.139","TCP","60","80  >  65264 [ACK] Seq=1 Ack=402 Win=64128 Len=0"
"118","23.402183","181.188.188.204","192.168.100.139","HTTP","397","HTTP/1.1 301 Moved Permanently "
"119","23.413450","2800:cd0:bb1b:6b00:5ce6:9a9d:6e99:5810","2800:cd0:ff:0:200:87:100:10","DNS","89","Standard query 0xc18e A potosi.bo"
"120","23.413742","2800:cd0:bb1b:6b00:5ce6:9a9d:6e99:5810","2800:cd0:ff:0:200:87:100:10","DNS","89","Standard query 0xe6a8 AAAA potosi.bo"
"121","23.440230","2800:cd0:ff:0:200:87:100:10","2800:cd0:bb1b:6b00:5ce6:9a9d:6e99:5810","DNS","105","Standard query response 0xc18e A potosi.bo A 181.188.188.204"
"122","23.440231","2800:cd0:ff:0:200:87:100:10","2800:cd0:bb1b:6b00:5ce6:9a9d:6e99:5810","DNS","130","Standard query response 0xe6a8 AAAA potosi.bo SOA potosi.bo"
"123","23.442159","192.168.100.139","181.188.188.204","TCP","66","65265  >  443 [SYN] Seq=0 Win=64240 Len=0 MSS=1460 WS=256 SACK_PERM=1"
"124","23.450136","192.168.100.139","181.188.188.204","TCP","54","65264  >  80 [ACK] Seq=402 Ack=344 Win=262144 Len=0"
"125","23.461450","181.188.188.204","192.168.100.139","TCP","60","443  >  65265 [RST, ACK] Seq=1 Ack=1 Win=0 Len=0"
"126","23.674747","192.168.100.139","181.188.188.204","TCP","66","65266  >  443 [SYN] Seq=0 Win=64240 Len=0 MSS=1460 WS=256 SACK_PERM=1"
"127","23.694528","181.188.188.204","192.168.100.139","TCP","60","443  >  65266 [RST, ACK] Seq=1 Ack=1 Win=0 Len=0"
"128","23.976316","192.168.100.139","181.188.188.204","TCP","66","[TCP Retransmission] 65265  >  443 [SYN] Seq=0 Win=64240 Len=0 MSS=1460 WS=256 SACK_PERM=1"
"129","23.996074","181.188.188.204","192.168.100.139","TCP","60","443  >  65265 [RST, ACK] Seq=1 Ack=1 Win=0 Len=0"
"130","24.120515","192.168.100.139","239.255.255.250","SSDP","179","M-SEARCH * HTTP/1.1 "
"131","24.199131","192.168.100.139","181.188.188.204","TCP","66","[TCP Retransmission] 65266  >  443 [SYN] Seq=0 Win=64240 Len=0 MSS=1460 WS=256 SACK_PERM=1"
"132","24.218736","181.188.188.204","192.168.100.139","TCP","60","443  >  65266 [RST, ACK] Seq=1 Ack=1 Win=0 Len=0"
"133","24.501109","192.168.100.139","181.188.188.204","TCP","66","[TCP Retransmission] 65265  >  443 [SYN] Seq=0 Win=64240 Len=0 MSS=1460 WS=256 SACK_PERM=1"
"134","24.520130","181.188.188.204","192.168.100.139","TCP","60","443  >  65265 [RST, ACK] Seq=1 Ack=1 Win=0 Len=0"
"135","24.724096","192.168.100.139","181.188.188.204","TCP","66","[TCP Retransmission] 65266  >  443 [SYN] Seq=0 Win=64240 Len=0 MSS=1460 WS=256 SACK_PERM=1"
"136","24.743499","181.188.188.204","192.168.100.139","TCP","60","443  >  65266 [RST, ACK] Seq=1 Ack=1 Win=0 Len=0"
"137","25.026110","192.168.100.139","181.188.188.204","TCP","66","[TCP Retransmission] 65265  >  443 [SYN] Seq=0 Win=64240 Len=0 MSS=1460 WS=256 SACK_PERM=1"
"138","25.044895","181.188.188.204","192.168.100.139","TCP","60","443  >  65265 [RST, ACK] Seq=1 Ack=1 Win=0 Len=0"
"139","25.249133","192.168.100.139","181.188.188.204","TCP","66","[TCP Retransmission] 65266  >  443 [SYN] Seq=0 Win=64240 Len=0 MSS=1460 WS=256 SACK_PERM=1"
"140","25.262473","192.168.100.139","181.188.188.204","TCP","66","65267  >  80 [SYN] Seq=0 Win=64240 Len=0 MSS=1460 WS=256 SACK_PERM=1"
"141","25.268290","181.188.188.204","192.168.100.139","TCP","60","443  >  65266 [RST, ACK] Seq=1 Ack=1 Win=0 Len=0"
"142","25.281300","181.188.188.204","192.168.100.139","TCP","66","80  >  65267 [SYN, ACK] Seq=0 Ack=1 Win=64240 Len=0 MSS=1412 SACK_PERM=1 WS=128"
"143","25.281456","192.168.100.139","181.188.188.204","TCP","54","65267  >  80 [ACK] Seq=1 Ack=1 Win=262400 Len=0"
"144","25.282663","192.168.100.139","181.188.188.204","HTTP","451","GET / HTTP/1.1 "
"145","25.301442","181.188.188.204","192.168.100.139","TCP","60","80  >  65267 [ACK] Seq=1 Ack=398 Win=64128 Len=0"
"146","25.551230","192.168.100.139","181.188.188.204","TCP","66","[TCP Retransmission] 65265  >  443 [SYN] Seq=0 Win=64240 Len=0 MSS=1460 WS=256 SACK_PERM=1"
"147","25.569764","181.188.188.204","192.168.100.139","TCP","60","443  >  65265 [RST, ACK] Seq=1 Ack=1 Win=0 Len=0"
"148","25.710266","2800:cd0:bb1b:6b00:5ce6:9a9d:6e99:5810","2600:9000:25a9:7600:2:8588:ed80:93a1","TCP","75","65251  >  443 [ACK] Seq=1 Ack=1 Win=1022 Len=1 [TCP segment of a reassembled PDU]"
"149","25.745102","2600:9000:25a9:7600:2:8588:ed80:93a1","2800:cd0:bb1b:6b00:5ce6:9a9d:6e99:5810","TCP","86","443  >  65251 [ACK] Seq=1 Ack=2 Win=133 Len=0 SLE=1 SRE=2"
"150","25.774214","192.168.100.139","181.188.188.204","TCP","66","[TCP Retransmission] 65266  >  443 [SYN] Seq=0 Win=64240 Len=0 MSS=1460 WS=256 SACK_PERM=1"
"151","25.793164","181.188.188.204","192.168.100.139","TCP","60","443  >  65266 [RST, ACK] Seq=1 Ack=1 Win=0 Len=0"
"152","26.634302","181.188.188.204","192.168.100.139","TCP","1466","80  >  65267 [ACK] Seq=1 Ack=398 Win=64128 Len=1412 [TCP segment of a reassembled PDU]"
"153","26.634533","181.188.188.204","192.168.100.139","TCP","1466","80  >  65267 [ACK] Seq=1413 Ack=398 Win=64128 Len=1412 [TCP segment of a reassembled PDU]"
"154","26.634535","181.188.188.204","192.168.100.139","TCP","1466","80  >  65267 [ACK] Seq=2825 Ack=398 Win=64128 Len=1412 [TCP segment of a reassembled PDU]"
"155","26.634536","181.188.188.204","192.168.100.139","TCP","1466","80  >  65267 [ACK] Seq=4237 Ack=398 Win=64128 Len=1412 [TCP segment of a reassembled PDU]"
"156","26.634536","181.188.188.204","192.168.100.139","TCP","1466","80  >  65267 [ACK] Seq=5649 Ack=398 Win=64128 Len=1412 [TCP segment of a reassembled PDU]"
"157","26.634537","181.188.188.204","192.168.100.139","TCP","1466","80  >  65267 [ACK] Seq=7061 Ack=398 Win=64128 Len=1412 [TCP segment of a reassembled PDU]"
"158","26.634662","192.168.100.139","181.188.188.204","TCP","54","65267  >  80 [ACK] Seq=398 Ack=8473 Win=262400 Len=0"
"159","26.634703","181.188.188.204","192.168.100.139","TCP","1466","80  >  65267 [ACK] Seq=8473 Ack=398 Win=64128 Len=1412 [TCP segment of a reassembled PDU]"
"160","26.635283","181.188.188.204","192.168.100.139","TCP","1466","80  >  65267 [ACK] Seq=9885 Ack=398 Win=64128 Len=1412 [TCP segment of a reassembled PDU]"
"161","26.635287","181.188.188.204","192.168.100.139","TCP","1466","80  >  65267 [ACK] Seq=11297 Ack=398 Win=64128 Len=1412 [TCP segment of a reassembled PDU]"
"162","26.635287","181.188.188.204","192.168.100.139","TCP","1466","80  >  65267 [ACK] Seq=12709 Ack=398 Win=64128 Len=1412 [TCP segment of a reassembled PDU]"
"163","26.635406","192.168.100.139","181.188.188.204","TCP","54","65267  >  80 [ACK] Seq=398 Ack=14121 Win=262400 Len=0"
"164","26.653395","181.188.188.204","192.168.100.139","TCP","1466","80  >  65267 [ACK] Seq=14121 Ack=398 Win=64128 Len=1412 [TCP segment of a reassembled PDU]"
"165","26.653396","181.188.188.204","192.168.100.139","TCP","1466","80  >  65267 [ACK] Seq=15533 Ack=398 Win=64128 Len=1412 [TCP segment of a reassembled PDU]"
"166","26.653400","181.188.188.204","192.168.100.139","TCP","1466","80  >  65267 [ACK] Seq=16945 Ack=398 Win=64128 Len=1412 [TCP segment of a reassembled PDU]"
"167","26.653693","192.168.100.139","181.188.188.204","TCP","54","65267  >  80 [ACK] Seq=398 Ack=18357 Win=262400 Len=0"
"168","26.653787","181.188.188.204","192.168.100.139","TCP","1466","80  >  65267 [ACK] Seq=18357 Ack=398 Win=64128 Len=1412 [TCP segment of a reassembled PDU]"
"169","26.653787","181.188.188.204","192.168.100.139","TCP","1466","80  >  65267 [ACK] Seq=19769 Ack=398 Win=64128 Len=1412 [TCP segment of a reassembled PDU]"
"170","26.653792","181.188.188.204","192.168.100.139","TCP","1466","80  >  65267 [ACK] Seq=21181 Ack=398 Win=64128 Len=1412 [TCP segment of a reassembled PDU]"
"171","26.653792","181.188.188.204","192.168.100.139","HTTP","550","HTTP/1.1 200 OK  (text/html)"
"172","26.653981","192.168.100.139","181.188.188.204","TCP","54","65267  >  80 [ACK] Seq=398 Ack=23089 Win=262400 Len=0"
"173","26.812079","2800:cd0:bb1b:6b00:5ce6:9a9d:6e99:5810","2800:cd0:ff:0:200:87:100:10","DNS","100","Standard query 0xa180 A fonts.googleapis.com"
"174","26.812526","2800:cd0:bb1b:6b00:5ce6:9a9d:6e99:5810","2800:cd0:ff:0:200:87:100:10","DNS","100","Standard query 0xdd7f AAAA fonts.googleapis.com"
"175","26.815486","2800:cd0:bb1b:6b00:5ce6:9a9d:6e99:5810","2800:cd0:ff:0:200:87:100:10","DNS","87","Standard query 0x6e54 AAAA s.w.org"
"176","26.815557","2800:cd0:bb1b:6b00:5ce6:9a9d:6e99:5810","2800:cd0:ff:0:200:87:100:10","DNS","87","Standard query 0xdbe9 A s.w.org"
"177","26.838716","2800:cd0:ff:0:200:87:100:10","2800:cd0:bb1b:6b00:5ce6:9a9d:6e99:5810","DNS","116","Standard query response 0xa180 A fonts.googleapis.com A 142.250.0.95"
"178","26.839163","2800:cd0:ff:0:200:87:100:10","2800:cd0:bb1b:6b00:5ce6:9a9d:6e99:5810","DNS","128","Standard query response 0xdd7f AAAA fonts.googleapis.com AAAA 2800:3f0:4003:c03::5f"
"179","26.842104","2800:cd0:ff:0:200:87:100:10","2800:cd0:bb1b:6b00:5ce6:9a9d:6e99:5810","DNS","148","Standard query response 0x6e54 AAAA s.w.org SOA ns1.wordpress.org"
"180","26.842105","2800:cd0:ff:0:200:87:100:10","2800:cd0:bb1b:6b00:5ce6:9a9d:6e99:5810","DNS","103","Standard query response 0xdbe9 A s.w.org A 192.0.77.48"
"181","27.023547","2800:cd0:bb1b:6b00:5ce6:9a9d:6e99:5810","2800:cd0:ff:0:200:87:100:10","DNS","100","Standard query 0x0605 A fonts.googleapis.com"
"182","27.050124","2800:cd0:ff:0:200:87:100:10","2800:cd0:bb1b:6b00:5ce6:9a9d:6e99:5810","DNS","116","Standard query response 0x0605 A fonts.googleapis.com A 142.250.0.95"
"183","28.196300","192.168.100.139","181.188.188.204","TCP","66","65268  >  80 [SYN] Seq=0 Win=64240 Len=0 MSS=1460 WS=256 SACK_PERM=1"
"184","28.197525","192.168.100.139","181.188.188.204","TCP","66","65269  >  80 [SYN] Seq=0 Win=64240 Len=0 MSS=1460 WS=256 SACK_PERM=1"
"185","28.198627","192.168.100.139","181.188.188.204","HTTP","460","GET /wp-includes/js/wp-emoji-release.min.js?ver=6.0.5 HTTP/1.1 "
"186","28.198906","192.168.100.139","181.188.188.204","TCP","66","65270  >  80 [SYN] Seq=0 Win=64240 Len=0 MSS=1460 WS=256 SACK_PERM=1"
"187","28.200327","192.168.100.139","181.188.188.204","TCP","66","65271  >  80 [SYN] Seq=0 Win=64240 Len=0 MSS=1460 WS=256 SACK_PERM=1"
"188","28.201309","192.168.100.139","181.188.188.204","TCP","66","65272  >  80 [SYN] Seq=0 Win=64240 Len=0 MSS=1460 WS=256 SACK_PERM=1"
"189","28.214326","2800:cd0:bb1b:6b00:5ce6:9a9d:6e99:5810","2800:3f0:4003:c03::5f","TCP","86","65273  >  80 [SYN] Seq=0 Win=64952 Len=0 MSS=1412 WS=256 SACK_PERM=1"
"190","28.215303","181.188.188.204","192.168.100.139","TCP","66","80  >  65268 [SYN, ACK] Seq=0 Ack=1 Win=64240 Len=0 MSS=1412 SACK_PERM=1 WS=128"
"191","28.215568","192.168.100.139","181.188.188.204","TCP","54","65268  >  80 [ACK] Seq=1 Ack=1 Win=262400 Len=0"
"192","28.215580","2800:cd0:bb1b:6b00:5ce6:9a9d:6e99:5810","2800:3f0:4003:c03::5f","TCP","86","65274  >  443 [SYN] Seq=0 Win=64952 Len=0 MSS=1412 WS=256 SACK_PERM=1"
"193","28.216016","2800:cd0:bb1b:6b00:5ce6:9a9d:6e99:5810","2800:3f0:4003:c03::5f","TCP","86","65275  >  443 [SYN] Seq=0 Win=64952 Len=0 MSS=1412 WS=256 SACK_PERM=1"
"194","28.216152","181.188.188.204","192.168.100.139","TCP","66","80  >  65269 [SYN, ACK] Seq=0 Ack=1 Win=64240 Len=0 MSS=1412 SACK_PERM=1 WS=128"
"195","28.216395","192.168.100.139","181.188.188.204","TCP","54","65269  >  80 [ACK] Seq=1 Ack=1 Win=262400 Len=0"
"196","28.216848","181.188.188.204","192.168.100.139","TCP","60","80  >  65267 [ACK] Seq=23089 Ack=804 Win=64128 Len=0"
"197","28.217363","192.168.100.139","181.188.188.204","HTTP","485","GET /wp-includes/css/dist/block-library/style.min.css?ver=6.0.5 HTTP/1.1 "
"198","28.217375","192.168.100.139","181.188.188.204","HTTP","493","GET /wp-content/plugins/wpdm-gutenberg-blocks/build/style.css?ver=6.0.5 HTTP/1.1 "
"199","28.218023","181.188.188.204","192.168.100.139","TCP","66","80  >  65270 [SYN, ACK] Seq=0 Ack=1 Win=64240 Len=0 MSS=1412 SACK_PERM=1 WS=128"
"200","28.218180","192.168.100.139","181.188.188.204","TCP","54","65270  >  80 [ACK] Seq=1 Ack=1 Win=262400 Len=0"
"201","28.218208","181.188.188.204","192.168.100.139","TCP","66","80  >  65271 [SYN, ACK] Seq=0 Ack=1 Win=64240 Len=0 MSS=1412 SACK_PERM=1 WS=128"
"202","28.218348","192.168.100.139","181.188.188.204","TCP","54","65271  >  80 [ACK] Seq=1 Ack=1 Win=262400 Len=0"
"203","28.219015","181.188.188.204","192.168.100.139","TCP","66","80  >  65272 [SYN, ACK] Seq=0 Ack=1 Win=64240 Len=0 MSS=1412 SACK_PERM=1 WS=128"
"204","28.219139","192.168.100.139","181.188.188.204","TCP","54","65272  >  80 [ACK] Seq=1 Ack=1 Win=262400 Len=0"
"205","28.219240","192.168.100.139","181.188.188.204","HTTP","503","GET /wp-content/plugins/download-manager/assets/fontawesome/css/all.css?ver=6.0.5 HTTP/1.1 "
"206","28.219243","192.168.100.139","181.188.188.204","HTTP","494","GET /wp-content/plugins/contact-form-7/includes/css/styles.css?ver=5.5.2 HTTP/1.1 "
"207","28.219875","181.188.188.204","192.168.100.139","TCP","1466","80  >  65267 [ACK] Seq=23089 Ack=804 Win=64128 Len=1412 [TCP segment of a reassembled PDU]"
"208","28.219879","181.188.188.204","192.168.100.139","TCP","1466","80  >  65267 [ACK] Seq=24501 Ack=804 Win=64128 Len=1412 [TCP segment of a reassembled PDU]"
"209","28.219881","181.188.188.204","192.168.100.139","TCP","1466","80  >  65267 [ACK] Seq=25913 Ack=804 Win=64128 Len=1412 [TCP segment of a reassembled PDU]"
"210","28.219881","181.188.188.204","192.168.100.139","HTTP","1178","HTTP/1.1 200 OK  (application/javascript)"
"211","28.220016","192.168.100.139","181.188.188.204","HTTP","511","GET /wp-content/plugins/download-manager/assets/bootstrap/css/bootstrap.min.css?ver=6.0.5 HTTP/1.1 "
"212","28.220172","192.168.100.139","181.188.188.204","TCP","54","65267  >  80 [ACK] Seq=804 Ack=28449 Win=262400 Len=0"
"213","28.224708","192.168.100.139","181.188.188.204","HTTP","493","GET /wp-content/plugins/download-manager/assets/css/front.css?ver=6.0.5 HTTP/1.1 "
"214","28.236365","181.188.188.204","192.168.100.139","TCP","60","80  >  65269 [ACK] Seq=1 Ack=440 Win=64128 Len=0"
"215","28.236504","181.188.188.204","192.168.100.139","TCP","60","80  >  65268 [ACK] Seq=1 Ack=432 Win=64128 Len=0"
"216","28.239853","181.188.188.204","192.168.100.139","HTTP","598","HTTP/1.1 200 OK  (text/css)"
"217","28.240231","181.188.188.204","192.168.100.139","TCP","60","80  >  65270 [ACK] Seq=1 Ack=441 Win=64128 Len=0"
"218","28.240383","181.188.188.204","192.168.100.139","TCP","60","80  >  65272 [ACK] Seq=1 Ack=458 Win=64128 Len=0"
"219","28.240555","181.188.188.204","192.168.100.139","TCP","60","80  >  65271 [ACK] Seq=1 Ack=450 Win=64128 Len=0"
"220","28.240906","181.188.188.204","192.168.100.139","HTTP","1362","HTTP/1.1 200 OK  (text/css)"
"221","28.243018","192.168.100.139","181.188.188.204","HTTP","491","GET /wp-content/plugins/popup-builder/public/css/theme.css?ver=4.1.13 HTTP/1.1 "
"222","28.243666","192.168.100.139","181.188.188.204","HTTP","489","GET /wp-content/plugins/wpdm-button-templates/buttons.css?ver=6.0.5 HTTP/1.1 "
"223","28.246944","181.188.188.204","192.168.100.139","TCP","1466","80  >  65272 [ACK] Seq=1 Ack=458 Win=64128 Len=1412 [TCP segment of a reassembled PDU]"
"224","28.246945","181.188.188.204","192.168.100.139","TCP","1466","80  >  65272 [ACK] Seq=1413 Ack=458 Win=64128 Len=1412 [TCP segment of a reassembled PDU]"
"225","28.247156","192.168.100.139","181.188.188.204","TCP","54","65272  >  80 [ACK] Seq=458 Ack=2825 Win=262400 Len=0"
"226","28.247197","181.188.188.204","192.168.100.139","TCP","1466","80  >  65272 [ACK] Seq=2825 Ack=458 Win=64128 Len=1412 [TCP segment of a reassembled PDU]"
"227","28.247198","181.188.188.204","192.168.100.139","TCP","1466","80  >  65272 [ACK] Seq=4237 Ack=458 Win=64128 Len=1412 [TCP segment of a reassembled PDU]"
"228","28.247202","181.188.188.204","192.168.100.139","TCP","1466","80  >  65272 [ACK] Seq=5649 Ack=458 Win=64128 Len=1412 [TCP segment of a reassembled PDU]"
"229","28.247290","192.168.100.139","181.188.188.204","TCP","54","65272  >  80 [ACK] Seq=458 Ack=7061 Win=262400 Len=0"
"230","28.247871","181.188.188.204","192.168.100.139","TCP","1466","80  >  65272 [ACK] Seq=7061 Ack=458 Win=64128 Len=1412 [TCP segment of a reassembled PDU]"
"231","28.247872","181.188.188.204","192.168.100.139","TCP","1466","80  >  65272 [ACK] Seq=8473 Ack=458 Win=64128 Len=1412 [TCP segment of a reassembled PDU]"
"232","28.247878","181.188.188.204","192.168.100.139","HTTP","276","HTTP/1.1 200 OK  (text/css)"
"233","28.248066","192.168.100.139","181.188.188.204","TCP","54","65272  >  80 [ACK] Seq=458 Ack=10107 Win=262400 Len=0"
"234","28.248122","181.188.188.204","192.168.100.139","TCP","1466","80  >  65271 [ACK] Seq=1 Ack=450 Win=64128 Len=1412 [TCP segment of a reassembled PDU]"
"235","28.248123","181.188.188.204","192.168.100.139","TCP","1466","80  >  65271 [ACK] Seq=1413 Ack=450 Win=64128 Len=1412 [TCP segment of a reassembled PDU]"
"236","28.248228","192.168.100.139","181.188.188.204","TCP","54","65271  >  80 [ACK] Seq=450 Ack=2825 Win=262400 Len=0"
"237","28.248905","181.188.188.204","192.168.100.139","TCP","1466","80  >  65271 [ACK] Seq=2825 Ack=450 Win=64128 Len=1412 [TCP segment of a reassembled PDU]"
"238","28.248907","181.188.188.204","192.168.100.139","TCP","1466","80  >  65271 [ACK] Seq=4237 Ack=450 Win=64128 Len=1412 [TCP segment of a reassembled PDU]"
"239","28.249145","192.168.100.139","181.188.188.204","TCP","54","65271  >  80 [ACK] Seq=450 Ack=5649 Win=262400 Len=0"
"240","28.249202","181.188.188.204","192.168.100.139","TCP","1466","80  >  65271 [ACK] Seq=5649 Ack=450 Win=64128 Len=1412 [TCP segment of a reassembled PDU]"
"241","28.249204","181.188.188.204","192.168.100.139","TCP","1466","80  >  65271 [ACK] Seq=7061 Ack=450 Win=64128 Len=1412 [TCP segment of a reassembled PDU]"
"242","28.249211","181.188.188.204","192.168.100.139","TCP","1466","80  >  65271 [ACK] Seq=8473 Ack=450 Win=64128 Len=1412 [TCP segment of a reassembled PDU]"
"243","28.249212","181.188.188.204","192.168.100.139","HTTP","437","HTTP/1.1 200 OK  (text/css)"
"244","28.249436","192.168.100.139","181.188.188.204","TCP","54","65271  >  80 [ACK] Seq=450 Ack=10268 Win=262400 Len=0"
"245","28.253763","192.168.100.139","181.188.188.204","HTTP","478","GET /wp-content/themes/whitehall/style.min.css?ver=6.0.5 HTTP/1.1 "
"246","28.255144","181.188.188.204","192.168.100.139","TCP","1466","80  >  65268 [ACK] Seq=1 Ack=432 Win=64128 Len=1412 [TCP segment of a reassembled PDU]"
"247","28.255146","181.188.188.204","192.168.100.139","TCP","1466","80  >  65268 [ACK] Seq=1413 Ack=432 Win=64128 Len=1412 [TCP segment of a reassembled PDU]"
"248","28.255413","192.168.100.139","181.188.188.204","TCP","54","65268  >  80 [ACK] Seq=432 Ack=2825 Win=262400 Len=0"
"249","28.255553","192.168.100.139","181.188.188.204","HTTP","489","GET /wp-content/themes/whitehall/assets/css/bootstrap.css?ver=6.0.5 HTTP/1.1 "
"250","28.255921","181.188.188.204","192.168.100.139","TCP","1466","80  >  65268 [ACK] Seq=2825 Ack=432 Win=64128 Len=1412 [TCP segment of a reassembled PDU]"
"251","28.255922","181.188.188.204","192.168.100.139","TCP","1466","80  >  65268 [ACK] Seq=4237 Ack=432 Win=64128 Len=1412 [TCP segment of a reassembled PDU]"
"252","28.255926","181.188.188.204","192.168.100.139","TCP","1466","80  >  65268 [ACK] Seq=5649 Ack=432 Win=64128 Len=1412 [TCP segment of a reassembled PDU]"
"253","28.255927","181.188.188.204","192.168.100.139","TCP","1466","80  >  65268 [ACK] Seq=7061 Ack=432 Win=64128 Len=1412 [TCP segment of a reassembled PDU]"
"254","28.256085","192.168.100.139","181.188.188.204","TCP","54","65268  >  80 [ACK] Seq=432 Ack=8473 Win=262400 Len=0"
"255","28.256115","181.188.188.204","192.168.100.139","TCP","1466","80  >  65268 [ACK] Seq=8473 Ack=432 Win=64128 Len=1412 [TCP segment of a reassembled PDU]"
"256","28.256116","181.188.188.204","192.168.100.139","TCP","1466","80  >  65268 [ACK] Seq=9885 Ack=432 Win=64128 Len=1412 [TCP segment of a reassembled PDU]"
"257","28.256117","181.188.188.204","192.168.100.139","HTTP","779","HTTP/1.1 200 OK  (text/css)"
"258","28.256117","181.188.188.204","192.168.100.139","TCP","1466","80  >  65267 [ACK] Seq=28449 Ack=1243 Win=64128 Len=1412 [TCP segment of a reassembled PDU]"
"259","28.256278","192.168.100.139","181.188.188.204","TCP","54","65268  >  80 [ACK] Seq=432 Ack=12022 Win=262400 Len=0"
"260","28.256314","181.188.188.204","192.168.100.139","TCP","1466","80  >  65267 [ACK] Seq=29861 Ack=1243 Win=64128 Len=1412 [TCP segment of a reassembled PDU]"
"261","28.256407","192.168.100.139","181.188.188.204","TCP","54","65267  >  80 [ACK] Seq=1243 Ack=31273 Win=262400 Len=0"
"262","28.256882","181.188.188.204","192.168.100.139","TCP","1466","80  >  65267 [ACK] Seq=31273 Ack=1243 Win=64128 Len=1412 [TCP segment of a reassembled PDU]"
"263","28.257030","181.188.188.204","192.168.100.139","TCP","1466","80  >  65267 [ACK] Seq=32685 Ack=1243 Win=64128 Len=1412 [TCP segment of a reassembled PDU]"
"264","28.257032","181.188.188.204","192.168.100.139","TCP","1466","80  >  65267 [ACK] Seq=34097 Ack=1243 Win=64128 Len=1412 [TCP segment of a reassembled PDU]"
"265","28.257034","181.188.188.204","192.168.100.139","TCP","1466","80  >  65267 [ACK] Seq=35509 Ack=1243 Win=64128 Len=1412 [TCP segment of a reassembled PDU]"
"266","28.257205","192.168.100.139","181.188.188.204","TCP","54","65267  >  80 [ACK] Seq=1243 Ack=36921 Win=262400 Len=0"
"267","28.257253","181.188.188.204","192.168.100.139","TCP","1466","80  >  65267 [ACK] Seq=36921 Ack=1243 Win=64128 Len=1412 [TCP segment of a reassembled PDU]"
"268","28.257255","181.188.188.204","192.168.100.139","TCP","1466","80  >  65267 [ACK] Seq=38333 Ack=1243 Win=64128 Len=1412 [TCP segment of a reassembled PDU]"
"269","28.257257","181.188.188.204","192.168.100.139","HTTP","881","HTTP/1.1 200 OK  (text/css)"
"270","28.257449","192.168.100.139","181.188.188.204","TCP","54","65267  >  80 [ACK] Seq=1243 Ack=40572 Win=262400 Len=0"
"271","28.263792","192.168.100.139","181.188.188.204","HTTP","495","GET /wp-content/themes/whitehall/assets/css/fontawesome-all.css?ver=6.0.5 HTTP/1.1 "
"272","28.264480","192.168.100.139","181.188.188.204","HTTP","488","GET /wp-content/themes/whitehall/assets/css/flaticon.css?ver=6.0.5 HTTP/1.1 "
"273","28.264982","181.188.188.204","192.168.100.139","TCP","1466","80  >  65270 [ACK] Seq=1309 Ack=876 Win=64128 Len=1412 [TCP segment of a reassembled PDU]"
"274","28.265004","181.188.188.204","192.168.100.139","TCP","1466","80  >  65270 [ACK] Seq=2721 Ack=876 Win=64128 Len=1412 [TCP segment of a reassembled PDU]"
"275","28.265240","192.168.100.139","181.188.188.204","TCP","54","65270  >  80 [ACK] Seq=876 Ack=4133 Win=262400 Len=0"
"276","28.265283","181.188.188.204","192.168.100.139","TCP","1466","80  >  65270 [ACK] Seq=4133 Ack=876 Win=64128 Len=1412 [TCP segment of a reassembled PDU]"
"277","28.265284","181.188.188.204","192.168.100.139","TCP","1466","80  >  65270 [ACK] Seq=5545 Ack=876 Win=64128 Len=1412 [TCP segment of a reassembled PDU]"
"278","28.265290","181.188.188.204","192.168.100.139","HTTP","1244","HTTP/1.1 200 OK  (text/css)"
"279","28.265422","192.168.100.139","181.188.188.204","TCP","54","65270  >  80 [ACK] Seq=876 Ack=8147 Win=262400 Len=0"
"280","28.267190","181.188.188.204","192.168.100.139","TCP","1466","80  >  65269 [ACK] Seq=545 Ack=877 Win=64128 Len=1412 [TCP segment of a reassembled PDU]"
"281","28.267436","181.188.188.204","192.168.100.139","TCP","1466","80  >  65269 [ACK] Seq=1957 Ack=877 Win=64128 Len=1412 [TCP segment of a reassembled PDU]"
"282","28.267470","181.188.188.204","192.168.100.139","TCP","1466","80  >  65269 [ACK] Seq=3369 Ack=877 Win=64128 Len=1412 [TCP segment of a reassembled PDU]"
"283","28.267471","181.188.188.204","192.168.100.139","TCP","1466","80  >  65269 [ACK] Seq=4781 Ack=877 Win=64128 Len=1412 [TCP segment of a reassembled PDU]"
"284","28.267680","192.168.100.139","181.188.188.204","TCP","54","65269  >  80 [ACK] Seq=877 Ack=6193 Win=262400 Len=0"
"285","28.267962","181.188.188.204","192.168.100.139","TCP","1466","80  >  65269 [ACK] Seq=6193 Ack=877 Win=64128 Len=1412 [TCP segment of a reassembled PDU]"
"286","28.267963","181.188.188.204","192.168.100.139","TCP","1466","80  >  65269 [ACK] Seq=7605 Ack=877 Win=64128 Len=1412 [TCP segment of a reassembled PDU]"
"287","28.267964","181.188.188.204","192.168.100.139","TCP","1466","80  >  65269 [ACK] Seq=9017 Ack=877 Win=64128 Len=1412 [TCP segment of a reassembled PDU]"
"288","28.267964","181.188.188.204","192.168.100.139","TCP","1466","80  >  65269 [ACK] Seq=10429 Ack=877 Win=64128 Len=1412 [TCP segment of a reassembled PDU]"
"289","28.267965","181.188.188.204","192.168.100.139","HTTP","704","HTTP/1.1 200 OK  (text/css)"
"290","28.268213","192.168.100.139","181.188.188.204","TCP","54","65269  >  80 [ACK] Seq=877 Ack=12491 Win=262400 Len=0"
"291","28.271558","192.168.100.139","181.188.188.204","HTTP","483","GET /wp-content/themes/whitehall/assets/css/owl.css?ver=6.0.5 HTTP/1.1 "
"292","28.271698","2800:3f0:4003:c03::5f","2800:cd0:bb1b:6b00:5ce6:9a9d:6e99:5810","TCP","86","443  >  65275 [SYN, ACK] Seq=0 Ack=1 Win=65535 Len=0 MSS=1440 SACK_PERM=1 WS=256"
